{"schema":"cdt-reference-raw-v1","implementation":{"name":"CDT-plusplus","version":"1.0.0","revision":"bd9cdbd373e274b200d7927fe4e4213df69000d2","compiler":"AppleClang 21.0.0.21000101","build_profile":"Release","operating_system":"Darwin","hardware":"arm64","logical_threads":16,"cxx_standard":23,"standard_library":"libc++-210106","cgal_version":"6.2-I-900"},"states":[{"id":"causal-simplex","coordinate_units":"initial_radius","time_units":"timeslice","time_bounds":[1,2],"f_vector":[4,6,4,1],"vertices":[{"id":"v00","position":[0,0,1],"time":1},{"id":"v01","position":[0,1,0],"time":1},{"id":"v02","position":[1,0,0],"time":1},{"id":"v03","position":[1.1547005383792515,1.1547005383792515,1.1547005383792515],"time":2}],"edges":[{"id":"e00","vertices":["v00","v01"],"type":"spacelike"},{"id":"e01","vertices":["v00","v02"],"type":"spacelike"},{"id":"e02","vertices":["v00","v03"],"type":"timelike"},{"id":"e03","vertices":["v01","v02"],"type":"spacelike"},{"id":"e04","vertices":["v01","v03"],"type":"timelike"},{"id":"e05","vertices":["v02","v03"],"type":"timelike"}],"facets":[{"id":"f00","vertices":["v00","v01","v02"],"spacelike":true,"time":1},{"id":"f01","vertices":["v00","v01","v03"],"spacelike":false},{"id":"f02","vertices":["v00","v02","v03"],"spacelike":false},{"id":"f03","vertices":["v01","v02","v03"],"spacelike":false}],"cells":[{"id":"c00","vertices":["v00","v01","v02","v03"],"type":"3-1","adjacent_cells":[]}]},{"id":"causality-filter-before","coordinate_units":"initial_radius","time_units":"timeslice","time_bounds":[1,3],"f_vector":[6,12,10,3],"vertices":[{"id":"v00","position":[0,0,1],"time":1},{"id":"v01","position":[0,1,0],"time":1},{"id":"v02","position":[1,0,0],"time":1},{"id":"v03","position":[0,0,2],"time":2},{"id":"v04","position":[2,0,0],"time":2},{"id":"v05","position":[0,3,0],"time":3}],"edges":[{"id":"e00","vertices":["v00","v01"],"type":"spacelike"},{"id":"e01","vertices":["v00","v02"],"type":"spacelike"},{"id":"e02","vertices":["v00","v03"],"type":"timelike"},{"id":"e03","vertices":["v01","v02"],"type":"spacelike"},{"id":"e04","vertices":["v01","v03"],"type":"timelike"},{"id":"e05","vertices":["v01","v04"],"type":"timelike"},{"id":"e06","vertices":["v01","v05"],"type":"timelike"},{"id":"e07","vertices":["v02","v03"],"type":"timelike"},{"id":"e08","vertices":["v02","v04"],"type":"timelike"},{"id":"e09","vertices":["v03","v04"],"type":"spacelike"},{"id":"e10","vertices":["v03","v05"],"type":"timelike"},{"id":"e11","vertices":["v04","v05"],"type":"timelike"}],"facets":[{"id":"f00","vertices":["v00","v01","v02"],"spacelike":true,"time":1},{"id":"f01","vertices":["v00","v01","v03"],"spacelike":false},{"id":"f02","vertices":["v00","v02","v03"],"spacelike":false},{"id":"f03","vertices":["v01","v02","v03"],"spacelike":false},{"id":"f04","vertices":["v01","v02","v04"],"spacelike":false},{"id":"f05","vertices":["v01","v03","v04"],"spacelike":false},{"id":"f06","vertices":["v01","v03","v05"],"spacelike":false},{"id":"f07","vertices":["v01","v04","v05"],"spacelike":false},{"id":"f08","vertices":["v02","v03","v04"],"spacelike":false},{"id":"f09","vertices":["v03","v04","v05"],"spacelike":false}],"cells":[{"id":"c00","vertices":["v00","v01","v02","v03"],"type":"3-1","adjacent_cells":["c01"]},{"id":"c01","vertices":["v01","v02","v03","v04"],"type":"2-2","adjacent_cells":["c00","c02"]},{"id":"c02","vertices":["v01","v03","v04","v05"],"type":"acausal","adjacent_cells":["c01"]}]},{"id":"causality-filter-after","coordinate_units":"initial_radius","time_units":"timeslice","time_bounds":[1,2],"f_vector":[5,9,7,2],"vertices":[{"id":"v00","position":[0,0,1],"time":1},{"id":"v01","position":[0,1,0],"time":1},{"id":"v02","position":[1,0,0],"time":1},{"id":"v03","position":[0,0,2],"time":2},{"id":"v04","position":[2,0,0],"time":2}],"edges":[{"id":"e00","vertices":["v00","v01"],"type":"spacelike"},{"id":"e01","vertices":["v00","v02"],"type":"spacelike"},{"id":"e02","vertices":["v00","v03"],"type":"timelike"},{"id":"e03","vertices":["v01","v02"],"type":"spacelike"},{"id":"e04","vertices":["v01","v03"],"type":"timelike"},{"id":"e05","vertices":["v01","v04"],"type":"timelike"},{"id":"e06","vertices":["v02","v03"],"type":"timelike"},{"id":"e07","vertices":["v02","v04"],"type":"timelike"},{"id":"e08","vertices":["v03","v04"],"type":"spacelike"}],"facets":[{"id":"f00","vertices":["v00","v01","v02"],"spacelike":true,"time":1},{"id":"f01","vertices":["v00","v01","v03"],"spacelike":false},{"id":"f02","vertices":["v00","v02","v03"],"spacelike":false},{"id":"f03","vertices":["v01","v02","v03"],"spacelike":false},{"id":"f04","vertices":["v01","v02","v04"],"spacelike":false},{"id":"f05","vertices":["v01","v03","v04"],"spacelike":false},{"id":"f06","vertices":["v02","v03","v04"],"spacelike":false}],"cells":[{"id":"c00","vertices":["v00","v01","v02","v03"],"type":"3-1","adjacent_cells":["c01"]},{"id":"c01","vertices":["v01","v02","v03","v04"],"type":"2-2","adjacent_cells":["c00"]}]},{"id":"move-23-before","coordinate_units":"initial_radius","time_units":"timeslice","time_bounds":[1,2],"f_vector":[5,9,7,2],"vertices":[{"id":"v00","position":[0,0,1],"time":1},{"id":"v01","position":[0,1,0],"time":1},{"id":"v02","position":[1,0,0],"time":1},{"id":"v03","position":[1.1547005383792515,1.1547005383792515,1.1547005383792515],"time":2},{"id":"v04","position":[1.4142135623730951,1.4142135623730951,0],"time":2}],"edges":[{"id":"e00","vertices":["v00","v01"],"type":"spacelike"},{"id":"e01","vertices":["v00","v02"],"type":"spacelike"},{"id":"e02","vertices":["v00","v03"],"type":"timelike"},{"id":"e03","vertices":["v01","v02"],"type":"spacelike"},{"id":"e04","vertices":["v01","v03"],"type":"timelike"},{"id":"e05","vertices":["v01","v04"],"type":"timelike"},{"id":"e06","vertices":["v02","v03"],"type":"timelike"},{"id":"e07","vertices":["v02","v04"],"type":"timelike"},{"id":"e08","vertices":["v03","v04"],"type":"spacelike"}],"facets":[{"id":"f00","vertices":["v00","v01","v02"],"spacelike":true,"time":1},{"id":"f01","vertices":["v00","v01","v03"],"spacelike":false},{"id":"f02","vertices":["v00","v02","v03"],"spacelike":false},{"id":"f03","vertices":["v01","v02","v03"],"spacelike":false},{"id":"f04","vertices":["v01","v02","v04"],"spacelike":false},{"id":"f05","vertices":["v01","v03","v04"],"spacelike":false},{"id":"f06","vertices":["v02","v03","v04"],"spacelike":false}],"cells":[{"id":"c00","vertices":["v00","v01","v02","v03"],"type":"3-1","adjacent_cells":["c01"]},{"id":"c01","vertices":["v01","v02","v03","v04"],"type":"2-2","adjacent_cells":["c00"]}]},{"id":"move-23-after","coordinate_units":"initial_radius","time_units":"timeslice","time_bounds":[1,2],"f_vector":[5,10,9,3],"vertices":[{"id":"v00","position":[0,0,1],"time":1},{"id":"v01","position":[0,1,0],"time":1},{"id":"v02","position":[1,0,0],"time":1},{"id":"v03","position":[1.1547005383792515,1.1547005383792515,1.1547005383792515],"time":2},{"id":"v04","position":[1.4142135623730951,1.4142135623730951,0],"time":2}],"edges":[{"id":"e00","vertices":["v00","v01"],"type":"spacelike"},{"id":"e01","vertices":["v00","v02"],"type":"spacelike"},{"id":"e02","vertices":["v00","v03"],"type":"timelike"},{"id":"e03","vertices":["v00","v04"],"type":"timelike"},{"id":"e04","vertices":["v01","v02"],"type":"spacelike"},{"id":"e05","vertices":["v01","v03"],"type":"timelike"},{"id":"e06","vertices":["v01","v04"],"type":"timelike"},{"id":"e07","vertices":["v02","v03"],"type":"timelike"},{"id":"e08","vertices":["v02","v04"],"type":"timelike"},{"id":"e09","vertices":["v03","v04"],"type":"spacelike"}],"facets":[{"id":"f00","vertices":["v00","v01","v02"],"spacelike":true,"time":1},{"id":"f01","vertices":["v00","v01","v03"],"spacelike":false},{"id":"f02","vertices":["v00","v01","v04"],"spacelike":false},{"id":"f03","vertices":["v00","v02","v03"],"spacelike":false},{"id":"f04","vertices":["v00","v02","v04"],"spacelike":false},{"id":"f05","vertices":["v00","v03","v04"],"spacelike":false},{"id":"f06","vertices":["v01","v02","v04"],"spacelike":false},{"id":"f07","vertices":["v01","v03","v04"],"spacelike":false},{"id":"f08","vertices":["v02","v03","v04"],"spacelike":false}],"cells":[{"id":"c00","vertices":["v00","v01","v02","v04"],"type":"3-1","adjacent_cells":["c01","c02"]},{"id":"c01","vertices":["v00","v01","v03","v04"],"type":"2-2","adjacent_cells":["c00","c02"]},{"id":"c02","vertices":["v00","v02","v03","v04"],"type":"2-2","adjacent_cells":["c00","c01"]}]},{"id":"move-26-before","coordinate_units":"initial_radius","time_units":"timeslice","time_bounds":[0,2],"f_vector":[5,9,7,2],"vertices":[{"id":"v00","position":[0,0,0],"time":0},{"id":"v01","position":[0,0,1],"time":1},{"id":"v02","position":[0,1,0],"time":1},{"id":"v03","position":[1,0,0],"time":1},{"id":"v04","position":[1.1547005383792515,1.1547005383792515,1.1547005383792515],"time":2}],"edges":[{"id":"e00","vertices":["v00","v01"],"type":"timelike"},{"id":"e01","vertices":["v00","v02"],"type":"timelike"},{"id":"e02","vertices":["v00","v03"],"type":"timelike"},{"id":"e03","vertices":["v01","v02"],"type":"spacelike"},{"id":"e04","vertices":["v01","v03"],"type":"spacelike"},{"id":"e05","vertices":["v01","v04"],"type":"timelike"},{"id":"e06","vertices":["v02","v03"],"type":"spacelike"},{"id":"e07","vertices":["v02","v04"],"type":"timelike"},{"id":"e08","vertices":["v03","v04"],"type":"timelike"}],"facets":[{"id":"f00","vertices":["v00","v01","v02"],"spacelike":false},{"id":"f01","vertices":["v00","v01","v03"],"spacelike":false},{"id":"f02","vertices":["v00","v02","v03"],"spacelike":false},{"id":"f03","vertices":["v01","v02","v03"],"spacelike":true,"time":1},{"id":"f04","vertices":["v01","v02","v04"],"spacelike":false},{"id":"f05","vertices":["v01","v03","v04"],"spacelike":false},{"id":"f06","vertices":["v02","v03","v04"],"spacelike":false}],"cells":[{"id":"c00","vertices":["v00","v01","v02","v03"],"type":"1-3","adjacent_cells":["c01"]},{"id":"c01","vertices":["v01","v02","v03","v04"],"type":"3-1","adjacent_cells":["c00"]}]},{"id":"move-26-after","coordinate_units":"in